<?xml version="1.0" encoding="UTF-8" standalone="yes"?>
<SimEntity name="SimpleServer" version="0.1" xsi:noNamespaceSchemaLocation="http://diana.nps.edu/Simkit/simkit.xsd" xmlns:xsi="http://www.w3.org/2001/XMLSchema-instance">
    <Parameter type="simkit.random.RandomVariate" name="serviceTime"/>
    <Parameter type="int" name="totalNumberServers"/>
    <StateVariable name="numberInQueue" type="int"/>
    <StateVariable name="numberAvailableServers" type="int"/>
    <Event name="Run">
        <StateTransition state="numberInQueue">
            <Assignment value="0"/>
        </StateTransition>
        <StateTransition state="numberAvailableServers">
            <Assignment value="totalNumberServers"/>
        </StateTransition>
        <Coordinate y="0" x="10"/>
    </Event>
    <Event name="Arrival">
        <StateTransition state="numberInQueue">
            <Assignment value="numberInQueue + 1"/>
        </StateTransition>
        <Schedule condition="numberAvailableServers &gt; 0" priority="1.0" delay="0.0" event="StartService"/>
        <Coordinate y="100" x="10"/>
    </Event>
    <Event name="StartService">
        <StateTransition state="numberInQueue">
            <Assignment value="numberInQueue - 1"/>
        </StateTransition>
        <StateTransition state="numberAvailableServers">
            <Assignment value="numberAvailableServers - 1"/>
        </StateTransition>
        <Schedule delay="serviceTime.generate()" event="EndService"/>
        <Coordinate y="100" x="150"/>
    </Event>
    <Event name="EndService">
        <StateTransition state="numberAvailableServers">
            <Assignment value="numberAvailableServers + 1"/>
        </StateTransition>
        <Schedule condition="numberInQueue &gt; 0" priority="1.0" delay="0.0" event="StartService"/>
        <Coordinate y="100" x="320"/>
    </Event>
</SimEntity>

