<?xml version="1.0" encoding="UTF-8" standalone="yes"?>
<SimEntity name="Creator" package="examples" version="1.0" author="ahbuss" extend="SimEntityBase" xsi:noNamespaceSchemaLocation="http://diana.nps.edu/Simkit/simkit.xsd" xmlns:xsi="http://www.w3.org/2001/XMLSchema-instance">
    <StateVariable name="nextID" type="int">
        <Comment></Comment>
    </StateVariable>
    <Event name="Arrival">
        <Comment></Comment>
        <StateTransition state="nextID">
            <Assignment value="nextID+1"/>
        </StateTransition>
        <Schedule delay="0.0" event="CustomerArrival" condition="true" priority="DEFAULT">
            <Comment></Comment>
            <EdgeParameter value="new Integer(nextID)"/>
        </Schedule>
        <Code></Code>
        <Coordinate x="30.0" y="120.0"/>
    </Event>
    <Event name="CustomerArrival">
        <Comment></Comment>
        <Argument name="customer" type="Integer"/>
        <Code></Code>
        <Coordinate x="190.0" y="120.0"/>
    </Event>
    <Event name="Run">
        <Comment></Comment>
        <StateTransition state="nextID">
            <Assignment value="0"/>
        </StateTransition>
        <Code></Code>
        <Coordinate x="30.0" y="10.0"/>
    </Event>
</SimEntity>
