<?xml version="1.0" encoding="UTF-8" standalone="yes"?>
<SimEntity name="ServerWithReneges" package="examples" version="0.1.5" extend="SimEntityBase" xsi:noNamespaceSchemaLocation="http://diana.nps.edu/Simkit/simkit.xsd" xmlns:xsi="http://www.w3.org/2001/XMLSchema-instance">
    <Parameter name="numberServers" type="int"/>
    <Parameter name="serviceTime" type="simkit.random.RandomVariate"/>
    <Parameter name="renegeTime" type="simkit.random.RandomVariate"/>
    <StateVariable name="numberAvailableServers" type="int"/>
    <StateVariable name="queue" type="java.util.LinkedList&lt;Integer&gt;"/>
    <StateVariable name="numberServed" type="int"/>
    <StateVariable name="numberReneges" type="int">
        <Comment>this state variable stores the number of reneges</Comment>
        <Comment>as a Java int.</Comment>
    </StateVariable>
    <Event name="Run">
        <StateTransition state="numberAvailableServers">
            <Assignment value="getNumberServers()"/>
        </StateTransition>
        <StateTransition state="queue">
            <Operation method="clear()"/>
        </StateTransition>
        <StateTransition state="numberServed">
            <Assignment value="0"/>
        </StateTransition>
        <StateTransition state="numberReneges">
            <Assignment value="0"/>
        </StateTransition>
        <Coordinate x="35.0" y="15.0"/>
    </Event>
    <Event name="Arrival">
        <Argument name="customer" type="java.lang.Integer"/>
        <StateTransition state="queue">
            <Operation method="add(customer)"/>
        </StateTransition>
        <Schedule delay="renegeTime.generate()" event="Renege" priority="DEFAULT">
            <EdgeParameter value="customer"/>
        </Schedule>
        <Schedule delay="0.0" event="StartService" condition="getNumberAvailableServers() &gt; 0" priority="DEFAULT"/>
        <Coordinate x="25.0" y="105.0"/>
    </Event>
    <Event name="StartService">
        <LocalVariable name="customer" type="java.lang.Integer" value="queue.getFirst()">
            <Comment></Comment>
        </LocalVariable>
        <StateTransition state="queue">
            <Operation method="removeFirst()"/>
        </StateTransition>
        <StateTransition state="numberAvailableServers">
            <Assignment value="numberAvailableServers - 1"/>
        </StateTransition>
        <Cancel event="Renege">
            <EdgeParameter value="customer"/>
        </Cancel>
        <Schedule delay="serviceTime.generate()" event="EndService" priority="DEFAULT">
            <EdgeParameter value="customer"/>
        </Schedule>
        <Coordinate x="175.0" y="105.0"/>
    </Event>
    <Event name="EndService">
        <Argument name="customer1" type="java.lang.Integer"/>
        <StateTransition state="numberAvailableServers">
            <Assignment value="numberAvailableServers+1"/>
        </StateTransition>
        <StateTransition state="numberServed">
            <Assignment value="numberServed+1"/>
        </StateTransition>
        <Schedule event="StartService" condition="queue.size() &gt; 0" priority="HIGH"/>
        <Coordinate x="305.0" y="105.0"/>
    </Event>
    <Event name="Renege">
        <Argument name="customer2" type="java.lang.Integer"/>
        <StateTransition state="queue">
            <Operation method="remove(customer2)"/>
        </StateTransition>
        <StateTransition state="numberReneges">
            <Assignment value="numberReneges+1"/>
        </StateTransition>
        <Coordinate x="95.0" y="215.0"/>
    </Event>
</SimEntity>
