<?xml version="1.0" encoding="UTF-8" standalone="yes"?>
<SimEntity author="pjsulliv" extend="diskit.Obstacle" name="Barrier" package="Obstacles" version="1.0" xsi:noNamespaceSchemaLocation="http://diana.gl.nps.navy.mil/Simkit/simkit.xsd" xmlns:xsi="http://www.w3.org/2001/XMLSchema-instance">
    <Comment>A buoy which may be moving and effected by currents, wakes and tides.</Comment>
    <Parameter name="moverID" type="int">
        <Comment>Unique ID number for this object</Comment>
    </Parameter>
    <Parameter name="startPosition" type="diskit.Vec3d">
        <Comment>Center point of the barrier</Comment>
    </Parameter>
    <Parameter name="length" type="double">
        <Comment>length of the barrier</Comment>
    </Parameter>
    <Parameter name="width" type="double">
        <Comment>width of this pier</Comment>
    </Parameter>
    <Parameter name="height" type="double">
        <Comment>Height in meters above the waterline</Comment>
    </Parameter>
    <Parameter name="rotation" type="diskit.Vec4d">
        <Comment>Orientation in radians about the (Z DIS axis (Y for X3D)) example: 0 0 1 1.57</Comment>
    </Parameter>
    <StateVariable name="proximitySensor" type="diskit.Sensor">
        <Comment>Sensor used to detect when movers are getting close to the pier and should consider it for navigation</Comment>
    </StateVariable>
    <Event name="Run">
        <Comment>Initializes all state variables for each simulation run.</Comment>
        <Code/>
        <Coordinate x="30" y="30"/>
    </Event>
    <Event name="Init">
        <Comment>Used by diskit.ScenarioManager to register all entities</Comment>
        <Argument name="init" type="diskit.Mover3D"/>
        <StateTransition state="proximitySensor">
            <Assignment value="new diskit.SphereCutterSensor(this, getLength()/2)"/>
        </StateTransition>
        <Schedule condition="init == this" delay="0.0" event="RegisterSensor" priority="0.0">
            <Comment/>
            <EdgeParameter value="proximitySensor"/>
        </Schedule>
        <Schedule condition="init == this" delay="0.0" event="RegisterTarget" priority="0.0">
            <Comment/>
            <EdgeParameter value="this"/>
        </Schedule>
        <Code/>
        <Coordinate x="130" y="30"/>
    </Event>
    <Event name="RegisterSensor">
        <Comment>Passes Sensor to Relay for Registration</Comment>
        <Argument name="sensor" type="diskit.Sensor"/>
        <Code/>
        <Coordinate x="250" y="110"/>
    </Event>
    <Event name="RegisterTarget">
        <Comment/>
        <Argument name="target" type="diskit.Mover3D"/>
        <Code/>
        <Coordinate x="250" y="30"/>
    </Event>
    <Event name="Detection">
        <Comment>Detects when a mover is getting close to this object</Comment>
        <Argument name="sensor" type="diskit.Sensor">
            <Comment>Sensor that detected the mover</Comment>
        </Argument>
        <Argument name="mover" type="diskit.Mover3D">
            <Comment>Mover that is getting close to obstacle</Comment>
        </Argument>
        <Schedule condition="true" delay="0.0" event="ObstacleClose" priority="0">
            <Comment/>
            <EdgeParameter value="mover"/>
            <EdgeParameter value="this"/>
        </Schedule>
        <Code/>
        <Coordinate x="150" y="210"/>
    </Event>
    <Event name="ObstacleClose">
        <Comment>Notification event that passes obstacle information to the detected mover. Also adds mover to the close contact queue.</Comment>
        <Argument name="mover" type="diskit.Mover3D">
            <Comment>Mover who is close to this object</Comment>
        </Argument>
        <Argument name="buoy" type="diskit.Obstacle">
            <Comment>Object that may need to be avoided</Comment>
        </Argument>
        <Code/>
        <Coordinate x="260" y="210"/>
    </Event>
    <Event name="BarrierAttacked">
        <Comment>Scheduled by an entity who attempts to explode this object</Comment>
        <Schedule event="BarrierDestroyed"/>
        <Code/>
        <Coordinate x="150" y="320"/>
    </Event>
    <Event name="BarrierDestroyed">
        <Comment>Occurs when the barrier is attacked</Comment>
        <LocalVariable name="hiddenLocation" type="diskit.Vec3d" value="new diskit.Vec3d(0, 1000, 0)">
            <Comment>If the barrier is destroyed move it below the sea level</Comment>
        </LocalVariable>
        <Code>setStartPosition(hiddenLocation);</Code>
        <Coordinate x="250" y="320"/>
    </Event>
    <Code/>
</SimEntity>
